{
  "schemaVersion": "job.opsweave.io/v1",
  "jobId": "11111111-1111-4111-8111-111111111111",
  "pipelineId": "host-metrics-pipeline",
  "pipelineRevision": 1,
  "idempotencyKey": "host-metrics-batch-0001",
  "status": "QUEUED",
  "input": { "source": "http://172.17.0.1:18090/data-hosts.json", "limit": 10000 },
  "attempts": [],
  "lease": null,
  "checkpoint": null,
  "result": null,
  "maxAttempts": 3,
  "timeoutSeconds": 300,
  "createdAt": "2026-10-23T00:00:00Z",
  "updatedAt": "2026-10-23T00:00:00Z"
}
